,code,desc,fine,shortDesc
369,T200,PASSING A YELLOW TRAFFIC SIGNAL,$50.0,SIGNAL PASS YELLOW
370,T201,FAIL TO YIELD TO AN EMERGENCY VEHICLE,$150.0,FAIL YIELD EMER VEH
371,T202,RIGHT TURN ON RED VIOLATION NO TURN ON RED SIGN,$50.0,NO RIGHT TURN ON RED
372,T203,PASS A FLASHING YELLOW TRAFFIC SIGNAL,$50.0,SIGNAL FLASH YELLOW
373,T204,FAIL TO OBEY GREEN ARROW TRAFFIC SIGNAL,$50.0,SIGNAL GREEN ARROW
374,T205,OBSTRUCTING CROSSWALK OR INTERSECTION,$35.0,OBSTRUCT XWALK/INTER
375,T206,FAIL TO CLEAR INTERSECTION,$50.0,INTERSECT FAIL CLEAR
376,T207,TELEVISION VISIBLE TO VEHICLE OPERATOR,$100.0,TV VISIBLE OPERATOR
377,T208,DRIVE CMV W/O PROPER CLASS OR ENDORSEMENTS ON DL,$100.0,IMPROP CLASS/ENDORSE
378,T210,FAIL TO YIELD TO ANOTHER  VEHICLE,$25.0,FAIL YIELD  ROW VEH
379,T211,BOARD A VEHICLE WHILE IT IS IN MOTION,$10.0,VEH BOARD IN MOTION
380,T212,COAST WITH GEARS UNMESHED,$75.0,COAST GEAR UNMESHED
381,T214,FAIL TO YIELD WHEN EMERGING FROM AN ALLEY,$50.0,YIELD EMERG DRIVWAY
382,T216,UNAUTHORIZED LIGHTS ON VEHICLE,$25.0,UNAUTHORIZED LIGHTS
383,T217,DRIVE OVER MEDIAN,$100.0,DRIVE OVER MEDIAN
384,T218,FAIL TO WEAR  HELMET MOTORCYCLE/MOTOR DRIVEN CYCLE,$75.0,FAIL TO WEAR HELMET
385,T219,PASS WITHOUT CAUTION,$100.0,PASS W/OUT CAUTION
386,T220,PASS ON A HILL,$25.0,PASSING ON HILL
387,T224,DRIVE OFF THE ROADWAY,$25.0,DRIVING OFF ROADWAY
388,T225,FAIL TO STOP FOR APPROACHING SCHOOL BUS,$500.0,APPROACH STOP SCHBUS
389,T226,FAILURE TO PROVIDE METER STATS TO GOVT AGENCY,$1000.0,FAIL PROV METER STAT
390,T227,FAIL TO PROPERLY FASTEN TAGS TO VEHICLE,$50.0,TAGS FAIL TO FASTEN
391,T228,PROVIDE SHARED RIDES IN TAXICAB ILLEGALLY,$250.0,ILLEGAL SHARED RIDE
392,T229,UNAPPROVED ADVERTISEMENT IN OR ON VEH FOR HIRE,$100.0,TAXI UNAPROV ADVERTS
393,T230,IMPROPERLY DRESSED OPERATOR IN VEHICLE FOR HIRE,$25.0,TAXI IMP DRESS OPER
394,T231,FAILURE TO DISPLAY RATE STICKER SIGN,$150.0,FAIL DISP RATE STCKR
395,T232,FAIL TO REMOVE TAXICAB INSIGNIA,$100.0,TAXI N/REMOV INSIGNA
396,T234,OVERLOAD VEHICLE FOR HIRE,$25.0,TAXI OVERLOADED VEHI
397,T235,FAIL TO PROVIDE PASSENGER WITH A RECEIPT FROM TAXI,$150.0,TAXI N/PASS RECEIPT
398,T236,TAMPERING WITH METER OR SEALS,$1000.0,TAMPER METER OR SEAL
399,T237,OPERATING WITHOUT A METER,$1000.0,OPERATING WO METER
400,T238,OPERATING WITH A NON-FUNCTIONING METER,$1000.0,OPERAT NONFUNC METER
401,T239,OPERATING A CAB WITH OFF-SIZE WHEELS OR TIRES,$1000.0,OFFSIZE WHEEL/TIRE
402,T240,OPERATING A CAB WITH UNDER- OR OVER-INFLATED TIRES,$100.0,UNDER/OVER INFL TIRE
403,T241,DEFECTIVE SPEDOMETER IN VEHICLE FOR HIRE,$250.0,TAXI DFECT SPEEDOMTR
404,T242,NOT FOR HIRE TAXICAB ON TAXICAB STAND,$25.0,TAXI ON STAND N/HIRE
405,T247,USE OF UNREGISTERED VEHICLE,$25.0,USE OF UNREG VEHICLE
406,T249,ASKING FOR A DESTINATION,$50.0,DEST ASKING IN VIOL
407,T250,DRIVING CMV (CDL) WHILE DISQUALIFIED - OOS,$500.0,DRIVING CMV DISQUAL
408,T251,LOG VIOLATION (GENERAL / FORM AND MANNER) CMV,$100.0,LOG VIOLATION
409,T252,VIOLATION OF 11 HOUR RULE (PROPERTY),$100.0,VIO 11 HR RULE PROP
410,T253,VIOLATION OF 14 HOUR RULE (PROPERTY),$100.0,VIO 14 HR RULE PROP
411,T254,10 HOUR RULE VIOLATION (PASSENGER),$100.0,10 HR RULE VIO PASS
412,T255,VIOLATION OF 15 HOUR RULE (PASSENGER VEHICLE),$100.0,VIO 15 HR RULE P VEH
413,T256,60/70 HOUR RULE VIOLATION (PASSENGER),$100.0,60/70 HR RULE VIO
414,T257,NO DRIVER'S RECORD OF DUTY STATUS,$100.0,NO DRIVER DUTY STAT
415,T258,FALSE REPORT OF DRIVER'S DUTY STATUS,$100.0,FALSE RPT DUTY STAT
416,T259,DRIVER'S RECORD OF DUTY STATUS NOT CURRENT,$100.0,DUTY STATUS NOT CURR
417,T260,DRIVER FAILS TO MAINTAIN PREVIOUS 7 DAYS LOGS,$100.0,LOGS PRIOR 7 DAYS
418,T261,OPERATE A CMV WITHOUT A CDL,$100.0,OPERATE CMV W/O CDL
419,T262,LEARNER'S PERMIT WITHOUT ACCOMPANYING CDL HOLDER,$100.0,LEARNERS PMT NO CDL
420,T263,OPERATING A CMV WITH IMPROPER CDL GROUP,$100.0,IMPROP CDL GROUP
421,T264,INTERSTATE DRIVER UNDER 21 YEARS OF AGE OOS,$100.0,CDL INTERST UNDER 21
422,T265,OPER COMM VEH DRIVER NOT PHYSICALLY QUALIFIED OOS,$100.0,DR NOT PHYS QUALIFID
423,T266,NOT LICENSED FOR TYPE OF VEHICLE BEING OPERATED,$100.0,OPERATE VEH NOT LICS
424,T267,NO OR INVALID DRIVER'S LICENSE IN CMV,$100.0,NO/INVALID DL CMV
425,T268,NO VALID MEDICAL WAIVER IN DRIVER'S POSSESSION,$100.0,NO VALID MED WAIVER
426,T269,FAIL TO USE SEATBELT IN CMV,$100.0,NO SEATBELT CMV
427,T270,OPERATING CMV WITH LAMPS/REFLECTORS OBSCURED,$100.0,OPER CMV LAMP OBSCUR
428,T271,UNAUTHORIZED PERSON -PASSENGER VEHICLE,$100.0,UNAUTH PASSENGER
429,T272,NON-ENGLISH SPEAKING DRIVER - CMV - OOS,$100.0,NON-ENGLSH SP DRIVER
430,T273,NO MEDICAL CERTIFICATE IN DRIVER'S POSS - OOS,$100.0,NO DRIV MED CERT PV
431,T274,IMPROPER MEDICAL EXAMINER'S CERTIFICATE FORM,$100.0,IMPROP MED CERT
432,T275,EXPIRED MEDICAL CERTIFICATE,$100.0,EXP MED CERTIFICATE
433,T276,SPEEDING IN CMV UP TO 10 MPH OVER SPEED LIMIT,$100.0,CMV SPEED 10MPH OVER
434,T277,SPEEDING IN CMV 11-14 MPH OVER SPEED LIMIT,$100.0,CMV SPEED 11-14 MPH
435,T278,SPEEDING IN CMV 15 MPH OVER SPEED LIMIT,$100.0,CMV SPEED 15 MPH
436,T279,OVERHEIGHT COMMERCIAL MOTOR VEHICLE,$100.0,OVERHEIGHT CMV
437,T280,OVERWIDTH COMMERCIAL MOTOR VEHICLE,$100.0,OVERWIDTH CMV
438,T281,OVERLENGTH COMMERCIAL MOTOR VEHICLE,$250.0,OVERLENGTH CMV
439,T282,FAIL TO OBEY TRAFFIC CONTROL DEVICE COMM VEHICLE,$100.0,FAIL OBEY TRFIC DEVC
440,T283,DRIVER VIOL OOS ORDER FOR INTOXICATING BEVERAGES,$1000.0,OOS ORDER INTOX BEV
441,T284,DRIVING AFTER BEING DECLARED OUT-OF-SERVICE,$1000.0,DRIVE AFTER OOS ORDR
442,T285,NO COPY OF USDOT HM REGISTRATION NUMBER,$1000.0,NO COPY OF USDOT NUM
443,T286,PROHIBITED PLACARDING,$250.0,PROHIB PLACARDING
444,T287,VEHICLE NOT PLACARDED AS REQUIRED,$250.0,VEH NOT PLACD AS REQ
445,T288,NO SHIPPING PAPER,$100.0,NO SHIPPING PAPER
446,T289,MAINTENANCE/ACCESSIBILITY OF ER INFORMATION,$100.0,MAINT/ACCESS ER INFO
447,T290,OPERATING AN OUT OF SERVICE VEHICLE,$1000.0,OPERATE OOS VEH
448,T291,DESCRIPTION OF HM ON SHIPPING PAPER,$100.0,HMDESC  ON SHIP DOC
449,T292,BLOCKING/BRACING AND SECURING HM,$250.0,SECURE HM
450,T293,NO EMERGENCY RESPONSE TELEPHONE NUMBER,$100.0,NO EMERG RESP NUMBER
451,T295,NO HAZARDOUS WASTE MANIFEST,$100.0,NO HM MANIFEST
452,T297,UNAPPROVED ADVERTISEMENT IN OR ON VEHICLE FOR HIRE,$250.0,UNAPPRVD AD VEH HIRE
453,T299,FAIL TO HAVE INSURANCE TAXI/VEHICLE FOR HIRE,$500.0,FAIL TO HVE INS
454,T300,PROHIBITED/PERMISSIVE PLACARDING,$100.0,PROHIBITED PLACARD
455,T333,FAIL TO DISPLAY PROOF OF VEHICLE INSURANCE,$30.0,FL TO DISP INSURANCE
456,T334,TURN RIGHT ON RED WITHOUT COMPLETE STOP,$50.0,FAIL CMPL STOP RONRD
457,T335,FAIL TO CONTROL VEHICLE SPEED TO AVOID COLLIDING,$150.0,FAIL CONTROL SPEED
458,T336,GREATER VEHICLE WIDTH THAN PERMITTED,$100.0,GRTR WIDTH THAN PERM
459,T337,UNLICENSED NON-DC LIMOUSINE OPERATOR,$500.0,NONDC OP LIMO NO LIC
460,T338,OPERATE TAXICAB WITHOUT ID CARD,$500.0,OPER CAB NO ID CARD
461,T339,OVERHEIGHT VEHICLE,$250.0,OVERHEIGHT
462,T340,DRIVE TRUCK WITH RESTRICTED PERMIT,$50.0,TRUCK PRMT RESTRICT
463,T341,UNAUTHORIZED ITEM ON WINDOW MIRROR OR FRAME,$15.0,UNAUTH ITEM ON WINDO
464,T342,UNAUTHORIZED TRAFFIC CONTROL DEVICE,$50.0,UNAUTH TRAF CNTL DEV
465,T343,UNSAFE BUMPER,$75.0,UNSAFE BUMPER
466,T344,OVERWEIGHT UP TO 5000 POUNDS OVER LIMIT,$250.0,UPTO 5000 LB OVR LMT
467,T345,VIOLATION OF TUNNEL RESTRICTIONS,$250.0,VIOL TUNNEL RESTRICT
468,T346,UNLICENSED  DC  OPERATOR,$1000.0,DC OP NO LICENSE
469,T347,UNLICENSED DC OPERATOR,$1000.0,UNLICENSED DC OPR
470,T348,HITCHING A RIDE ON A VEHICLE,$25.0,HITCHING ON VEHICLE
471,T349,IMPROPERLY RIDING ON VEHICLE,$100.0,IMPROP RIDING ON VEH
472,T350,NO FENDER(S) OR BUMPER(S),$25.0,NO FENDER(S)
473,T351,UNLICENSED NON-DC OPERATOR,$1000.0,UNLICENSE NON DC RES
474,T352,FAIL TO USE RUNNING LIGHT(S),$25.0,FAIL USE RUNING LGHT
475,T362,CDL OUT-OF-SERVICE VIOLATION,$100.0,CDL - OUT OF SERVICE
476,T363,CDL NOT-OUT-OF-SERVICE VIOLATION,$100.0,CDL - NOT OUT SERVIC
477,T364,HAZMAT OUT-OF-SERVICE VIOLATION,$100.0,HAZMAT OUT OF SERVIC
478,T365,HAZMAT NOT-OUT-OF-SERVICE VIOLATIONS,$100.0,HAZMAT NOT OUT SERVC
479,T366,WORK ZONE VIOLATION - FINE DOUBLES,$1000.0,CNSTRTN ZN FN DBL
480,T367,SCHOOL ZONE VIOLATION - FINE DOUBLES,$1000.0,SCHOOL ZONE FINE DBL
481,T400,UNREGISTERED VEHICLE 30 DAYS OR LESS,$100.0,UNREG VEH 30 DAYS
482,T404,UNREGISTERED VEHICLE MORE THAN 30 DAYS,$200.0,UNREG. VEH > 30 DAYS
483,T405,FAIL TO COMPLY - PERSONAL ANIMAL,$50.0,FAIL CMPLY PERS ANIM
484,T406,FAIL TO COMPLY SERVICE ANIMAL,$100.0,FAIL CMPLY SERV ANIM
485,T501,DRIVE THROUGH A FUNERAL PROCESSION,$25.0,DRIVE THRU FUNERAL P
486,T502,FAIL TO KEEP RIGHT IN A FUNERAL PROCESSION,$15.0,FUNERAL N/KEEP RIGHT
487,T503,UNLICENSED LIMOUSINE OPERATOR,$500.0,UNLICSD VEH LIMO
488,T504,LIMOUSINE OWNER PERMITTING UNLICENSED OPERATOR,$500.0,OWNR PRMT UNLIC LIMO
489,T505,UNLICENSED LIMOUSINE OPERATOR,$500.0,UNLICD LIMO DRIVER
490,T509,DRIVING OVER LAWN,$25.0,DRIVING OVER LAWN
491,T511,ILLEGAL HEADLIGHT(S),$75.0,ILLEGAL HEADLIGHT
492,T512,DEALER VEHICLE WITHOUT REGISTRATION,$50.0,DEAL VEHIC W/O REGIS
493,T513,DRIVING INSTRUCTOR WITHOUT LICENSE,$50.0,DRIVING INST W/O LIC
494,T514,OPERATE SCHOOL BUS WITHOUT PERMIT,$20.0,OPER SCHBUS W/O PMT
495,T515,SMOKE SCREEN,$50.0,SMOKE SCREENS
496,T516,TAMPER WITH LOCKED BICYCLE,$5.0,TAMP W/LOCKED BICYCL
497,T517,UNAUTHORIZED USE OF EMERGENCY PARKING PERMIT,$50.0,UNAUTH U/EMER PK PMT
498,T518,PERMIT OPERATION OF AN UNSAFE VEHICLE,$25.0,PMT OPER UNSAF VEHIC
499,T519,OPERATING UNSAFE PUBLIC VEHICLE FOR HIRE,$100.0,OPER UNSAFE VEH HIRE
500,T523,PASSING IN AN INTERSECTION,$25.0,PASSING AT INTERSECT
501,T524,PASSING ON A CURVE,$25.0,PASSING ON CURVE
502,T525,PASSING WITH AN OBSTRUCTED VIEW,$25.0,PASSING VIEW OBSTRUC
503,T526,SPEEDING TO PREVENT A VEHICLE FROM PASSING,$50.0,SPEED TO PREV PASSIN
504,T527,PEDESTRIAN WALK AGAINST A RED TRAFFIC SIGNAL,$20.0,PED WALK AGNST RED
505,T528,PEDESTRIAN WALKING SO AS TO CREATE A HAZARD,$5.0,PED CREATE HAZARD
506,T529,PEDESTRIAN FAIL TO YIELD TO EMERGENCY VEHICLE,$10.0,PED N/YIELD TO EMERG
507,T530,FAIL TO HAVE MOTORCYCLE PERMIT,$50.0,MOTORCYCLE NO PERMIT
508,T531,MOTORCYCLE PASSING IN TANDEM,$15.0,MOTCYCL 2 PASS N/TAN
509,T533,FAIL TO GIVE SIGNAL,$25.0,FAIL TO GIVE SIGNAL
510,T535,DISREGARD SLOW SIGN,$25.0,DISREGARD SLOW SIGN
511,T539,VIOLATION OF RESTRICTION ON LEARNER'S PERMIT,$100.0,VIOL REST LERNER PMT
512,T542,IMPROPER USE OF DEALER TAG(S),$50.0,IMP USE DEALER TAGS
513,T555,VIOLATION OF TOWING REGULATIONS,$100.0,VIOL TOWING REG
514,T556,TOWING WITHOUT SAFETY CHAIN,$100.0,TOW REG N/SAFTY CHAN
515,T559,VIOLATION OF NO TURN SIGN,$25.0,TURN VIOL TURN SIGN
516,T560,UNAPPROVED VEHICLE OPERATOR,$20.0,UNAPPROV AUTO OPER
517,T561,PERMIT VEHICLE USE BY UNAUTHORIZED OPERATOR,$20.0,PERMT OPER UNAPP AUT
518,T562,MOTORCYCLE/ MOTOR DRIVEN CYCLE IMPROPER RIDING  ON,$100.0,IMPROPER RIDING
519,T563,PERMIT PASSENGER TO RIDE ON VEHICLE,$25.0,PERMT PASS RID ON VE
520,T564,OPERATE VEHICLE WITH DOORS OPEN,$25.0,OPER W/DOORS OPEN
521,T567,PASSING APPROACHING FIRE APPARATUS,$100.0,PASS/APPRCH FIRE APP
522,T571,IMPROPER TURN,$100.0,IMPROPER TURN
523,T575,FAIL TO OBEY DON'T WALK OR WAIT TRAFFIC SIGNAL,$20.0,DONT WALK/WAIT
524,T576,FAIL TO OBEY TRAFFIC SIGNAL IN CROSSWALK,$10.0,TRF SIGNAL/CROSSWALK
525,T577,PEDESTRIAN LEAVING CURB IN UNSAFE MANNER,$10.0,PED/LEAVE CURB UNSAF
526,T578,DIAGONAL CROSS AT INTERSECTION DISOBEYING SIGNAL,$20.0,DIAG CROSS DISOB SIG
527,T579,CROSSING AN INTERSECTION DIAGONALLY,$10.0,CROSS INTERSCT DIAG
528,T580,WALK IN ROADWAY WHERE SIDEWALK IS PROVIDED,$10.0,WALKING IN (SIDEWK)
529,T581,WALK ON WRONG SIDE OF STREET,$10.0,WALK ON WRONG SIDE
530,T583,PARADING WITHOUT A PERMIT,$50.0,PARADING W/O PERMIT
531,T585,COLLIDING WITH PEDESTRIAN,$500.0,COLLIDE W/PED
532,T590,DISTRACTED DRIVING,$100.0,DISTRACTED DRIVING
533,T591,DISTRACTED DRIVING USING CELL PHONE OTHER DEVICE,$100.0,CELL PHNE OTH DEVICE
534,T592,DISTRACTED DRIVING WHILE OPERATING SCHOOL BUS,$100.0,DIST DRVR SCHL BUS D
535,T600,FAIL TO OBEY OFFICER'S ORDERS,$15.0,FAIL OBEY OFFICER
536,T601,FAIL TO ABIDE BY PARADE PERMIT RESTRICTIONS,$25.0,PARADE PMT N/ABID RE
537,T602,DISPLAY FAKE INSPECTION STICKER,$25.0,DISP FAKE INSP STICK
538,T603,REMOVE INSPECTION STICKER,$10.0,REMOVE INSPECT STICK
539,T604,TAXICAB FAIL TO EXHIBIT ID CARD,$100.0,TAXI N/EXHIB ID CARD
540,T605,UNLICENSED VEHICLE NON-DC RESIDENT,$1000.0,UNLIC VEH NON DC RES
541,T607,BIKE/PMD FAIL YIELD ROW TO PED SIDEWALK/CROSSWALK,$25.0,PMD FAIL YLD ROW PED
542,T609,RIDE BIKE/PMD  SIDEWALK  CENTRAL BUSINESS DISTRICT,$25.0,RIDE PMD ON SIDEWLK
543,T610,RIDE TWO ON A BICYCLE,$25.0,RIDE 2 ON BIKE
544,T613,BIKE GIVE FALSE INFORMATION,$5.0,BIKE GIVE FALSE INFO
545,T614,BIKE IMPROPER EQUIPMENT,$25.0,BIKE IMP EQUIPMENT
546,T615,BIKE MOUNTING RACK VIOLATION,$25.0,BIKE MOUNT RAK VIOL
547,T616,IMPROPERLY SECURING BIKE,$25.0,BIKE IMPROPER SECUR
548,T617,NOT RIDING ON THE SEAT OF A BIKE,$25.0,BIKE N/RIDE ON SEAT
549,T618,PMD CARRY OBJECTS THAT HINDERS USE OF HANDLEBARS,$25.0,PMD CARRY OBJ IN HAN
550,T619,BIKE VIOLATION SOUNDING WARNING DEVICE,$25.0,BIKE SOUND WARN DEVC
551,T622,BIKE OR UNAUTHORIZED DEVICE ON THE HIGHWAY,$5.0,BIKE UNAUTH DEV HWAY
552,T623,OPERATE PMD WITH  EARS COVERED,$25.0,OPER PMD W/EAR COVER
553,T624,COMMERCIAL VEHICLE SPILT LOAD,$150.0,COMM VEH SPILL LOAD
554,T625,COMMERCIAL VEHICLE OPERATING WHILE IN PARK,$25.0,COMM VEH OPER I/PARK
555,T626,EXCESSIVE IDLING,$500.0,EXCESSIVE IDLING
556,T627,OPERATING WITH A TORN FENDER,$25.0,OPER W/TORN FENDER
557,T629,INAUDIBLE OR NO HORN,$15.0,HORN INAUD/NONE
558,T630,UNNECESSARY NOISE FROM HORN,$25.0,HORN UNNECES NOISE
559,T632,EXPIRED INSPECTION STICKER,$50.0,EXPIRED INSP STICK
560,T633,FAIL TO REPORT FOR INSPECTION,$50.0,FAIL REPT TO INSPECT
561,T634,FAIL TO REPLACE INSPECTION STICKER,$50.0,INSP FAIL REPL STKR
562,T635,LENGTH OVER 40'/55',$250.0,LENGTH OVR 40'/55'
563,T636,IMPROPER LIGHT(S),$75.0,LIGHTS IMPROPER
564,T637,NO REAR LIGHTS,$75.0,NO REAR LIGHTS
565,T638,NO STOP LIGHT(S),$75.0,NO STOP LIGHTS
566,T639,ONE RUNNING LIGHT,$75.0,ONE RUNNING LIGHT
567,T640,OPERATING HIGH BEAM LIGHTS,$75.0,LIGHTS OPER W/HIGH B
568,T641,FAIL TO SECURE TRASH LOAD,$250.0,LOADS N/SECUR TRASH
569,T642,FAIL TO SECURE SHIPPING CRATE LOAD,$25.0,LOADS N/SEC SHIP CRA
570,T643,LOAD OVER FENDER(S),$250.0,LOADS OVER FENDERS
571,T644,LOAD OVER 8 FEET WIDE,$250.0,LOAD OVER 8' WIDE MV
572,T645,NO RED FLAG ON END OF LOAD,$250.0,LOAD NO RED FLAG END
573,T646,NO REAR VIEW MIRROR ON MINIBIKE,$25.0,MINIBIKE N/REAR VIEW
574,T647,NO REAR VIEW MIRROR(S),$75.0,MIRRORS NO REAR VIEW
575,T649,LEAVING A MOTOR RUNNING UNATTENDED,$25.0,MOTOR RUNNING UNATT
576,T651,DEFECTIVE MUFFLER,$15.0,MUFFLER DEFECTIVE
577,T652,NO MUFFLER ON VEHICLE,$25.0,MUFFLER NONE ON VEHI
578,T653,UNNECESSARY NOISE,$25.0,UNNECESSARY NOISE
579,T654,VIOLATION OF ONE WAY STREET RESTRICTION,$100.0,ONE WAY ST VIOL OF
580,T655,FAIL TO CHANGE ADDRESS ON PERMIT,$50.0,PERMIT N/ADDRESS CHG
581,T656,CANCELLED SUSPENDED REVOKED OR ALTERED PERMIT,$50.0,PERMIT ALTER/INVALID
582,T657,FAIL TO CHANGE ADDRESS ON REGISTRATION,$10.0,REG FAIL CHG ADDRESS
583,T658,FAIL TO EXHIBIT REGISTRATION,$50.0,REG FAIL TO EXHIBIT
584,T659,UNAUTHORIZED USE OF SIREN,$50.0,SIREN UNAUTHRIZE USE
585,T660,EXCESSIVE SMOKE,$50.0,SMOKE EXCESSIVE
586,T661,NO SNOW TIRE OR CHAIN,$100.0,SNOW TIRE/CHAIN NONE
587,T662,DEFECTIVE SPEEDOMETER,$75.0,SPEEDOMETER DEFECTIV
588,T663,NO SPEEDOMETER,$75.0,SPEEDOMER NONE
589,T664,OPERATING STEAM SHOVEL DURING RESTRICTED HOURS,$10.0,STEAM SHOVEL RES HRS
590,T665,FAIL TO APPLY DC TAG,$500.0,NO DC APP TAG
591,T666,POORLY ILLUMINATED TAGS,$50.0,TAGS POOR ILLUMIN
592,T667,DEAD OR EXPIRED TAGS,$100.0,TAGS DEAD
593,T668,FAIL TO HAVE DC TAGS,$100.0,TAGS NO DC
594,T669,FAIL TO TURN IN DC TAGS,$100.0,TAGS FAIL TURN IN DC
595,T670,FAIL TO SECURE DC TAGS,$100.0,TAGS FAIL SECURE DC
596,T671,PERMIT USE OF EXPIRED TAGS,$100.0,PMT USE OF DEAD TAGS
597,T672,FAIL TO DISPLAY CURRENT TAGS,$100.0,TAGS FAIL DISP CURR
598,T673,LOANING TAGS,$50.0,TAGS LOANING
599,T674,ALTERED TAGS,$100.0,TAGS ALTERED
600,T675,TAXICAB DOME LIGHT,$100.0,TAXI DOME LIGHT
601,T676,DIRTY TAXICAB,$100.0,TAXI DIRTY
602,T677,FAIL TO CHANGE INFORMATION,$100.0,FAIL CHANGE INFO
603,T678,FAIL TO REMOVE ID FROM TAXICAB,$50.0,TAXI FAIL RMV ID CAB
604,T679,LOITERING TAXI OR LIMO,$50.0,LOITERING TAXI/LIMO
605,T680,FAIL TO KEEP TAXICAB MANIFEST,$50.0,TAXI MANFST FAIL KEP
606,T681,FAIL TO REPORT PROPERTY LEFT IN A TAXICAB,$25.0,TAXI PROP LEFT N/RPT
607,T682,SOLICITING FARES FOR A TAXICAB,$50.0,TAXI SOLICITNG FARES
608,T684,FAIL TO PULL TAXICAB TO THE CURB,$50.0,TAXI NO PULL TO CURB
609,T686,REFUSING TO HAUL PASSENGERS IN A TAXICAB,$500.0,REFUSE TO HAUL PASS
610,T687,UNLICENSED VEHICLE DC RESIDENT,$1000.0,UNLIC VEH DC RESIDNT
611,T688,FAIL TO DISPLAY OFF DUTY SIGN IN A TAXICAB,$100.0,TAXI N/DISP OFF DUTY
612,T689,IMPROPER USE OF THE OFF DUTY SIGN IN A TAXICAB,$100.0,TAXI IMP USE OFFDUTY
613,T690,IMPROPER USE OF THE ON CALL SIGN IN A TAXICAB,$100.0,TAXI IMP USE ONCALL
614,T691,IMPROPER USE OF AN OUT OF SERVICE SIGN IN A TAXI,$100.0,TAXI IMP USE OUT SVC
615,T692,UNAUTHORIZED SIGNS IN A TAXICAB,$100.0,TAXI UNAUTH SIGNS
616,T693,NOT CHARGING THE PROPER FARE IN A TAXICAB,$150.0,TAXI N/CHG PROP FARE
617,T694,FAIL TO DISPLAY PSC LICENSE IN TAXICAB,$10.0,TAXI N/DISP PSC LIC
618,T696,FAIL TO EXHIBIT DCTC TO HACK INSPECTOR OR POLICE,$50.0,TAXI N/EXHIBIT  DCTC
619,T697,FAIL TO HAVE PROPER INSIGNIA FOR TAXICAB,$25.0,TAXI N/HAV PROP INSG
620,T698,FAIL TO REPORT ACCIDENT INVOLVING A TAXICAB,$100.0,TAXI N/RPT ACCIDENT
621,T699,IMPROPER PSC LICENSE,$25.0,TAXI SIGN IMP PSC LI
622,T700,LOADING TAXICAB PASSENGERS IN A CROSSWALK,$50.0,TAXI LOAD PASS XWALK
623,T701,REFUSING TO PAY A TAXICAB FARE,$25.0,TAXI REFUS PAY FARE
624,T702,UNSAFE TIRE(S),$100.0,TIRES UNSAFE ETC
625,T703,FAIL TO TRANSFER DC TITLE,$25.0,TITLE DC FAIL TRANSF
626,T705,VIOLATION OF THE CHILD RESTRAINT ACT,$75.0,VIOL CHILD REST ACT
627,T706,OPERATING AN UNSAFE TAXI,$100.0,OPER UNSAFE VEH TAXI
628,T710,TRUCK RESTRICTED ROUTE,$150.0,TRUCK REST ROUTE
629,T711,OWNER OPERATE OR PERMIT OPERATION OF UNINSRD VEH,$500.0,OPER. UNIS. VEHICLE
630,T712,EXPIRED PERMIT 90 DAYS,$15.0,EXP. PERMIT -90 DAYS
631,T713,SEAT BELT REGULATION VIOLATION,$50.0,SEAT BELT REGULATION
632,T714,HUB CAP REGULATION,$25.0,HUB CAP REGULATION
633,T715,SEAT BELT REGULATION MULTIPLE VIOLATIONS,$50.0,SEAT BELT REG MULTI
634,T740,FAIL TO FILE AN ACCIDENT REPORT,$100.0,NOT FILE ACCIDNT RPT
635,T741,FAIL TO FILE OR INCOMPLETE ACCIDENT REPORT,$50.0,ACCIDNT RPT INN/INCO
636,T742,FAIL TO DISPLAY CURRENT INSPECTION STICKER,$50.0,FAIL DISP CURR INSPC
637,T743,OPERATING VEHICLE WITH CONDITIONAL INSPECTION,$100.0,INSPECT OPER W/COND
638,T744,ILLEGIBLE TAGS,$50.0,TAGS ILLEGIBLE
639,T745,NO FRONT TAGS,$50.0,NO FRONT TAGS
640,T746,NO REAR TAGS,$50.0,NO REAR TAGS
641,T747,OBSTRUCTED TAGS,$50.0,TAGS OBSTRUCTED
642,T748,FAIL TO PROPERLY AFFIX REGISTRATION STICKERS,$50.0,REGTR FAIL PROP AFFX
643,T749,DRIVING ON MEDIAN OR CHANNELIZING TRAFFIC ISLAND,$100.0,MEDIAN CHANNEL IS/SZ
644,T750,HIGH OCCUPANCY VEHICLE VIOLATION,$25.0,HOV VIOLATION
645,T751,OVERTAKING VEHICLE STOPPED AT XWALK FOR PEDESTRIAN,$250.0,PASS VEH STOP PED
646,T755,FAIL TO OBEY CIVILIAN TRAFFIC OFFICER,$50.0,FAIL OBEY CIVILIAN
647,T756,FAIL TO DISPLAY PASSENGER RIGHTS FORM IN TAXICAB,$25.0,NO PASS RIGHT FORM
648,T758,VIOLATION OF TINTED WINDOWS REGULATIONS,$50.0,TINTED WINDOWS
649,T759,FAIL TO YIELD RIGHT OF WAY TO PEDESTRIAN,$75.0,FL TO YLD ROW TO PED
650,T760,NO PERMIT PAST EXPIRATION DATE PLUS 90 DAYS,$75.0,NO PERMIT/EXP-90 DAY
651,T761,IMPROPER AIR CONDITIONING,$125.0,IMPROPER AIR CONDITN
652,T762,IMPROPER HEATING,$125.0,IMPROPER HEATING
653,T763,TINTED WINDOW VIOLATION FAIL TO COMPLY 1,$1000.0,TINT WNDW FAIL COMP1
654,T764,TINTED WINDOW VIOLATION FAIL TO COMPLY 2,$5000.0,TINT WNDW FAIL COMP2
655,T765,LITTERING FROM VEHICLE ON PRIVATE/PUBLIC PROPERTY,$100.0,LITTERING FROM VEH
656,T766,FAIL OR REFUSE TO FOLLOW POLICE OFFICER DIRECTION,$50.0,FAIL OBEY POLICE OFF
657,T768,LANE IMPROPER USE OF RESTRICTED,$100.0,LANEIMP USE RESTRIC
658,T778,IMPROPER CLASS LICENSE,$50.0,IMPROP CLASS LICENSE
659,T779,OPERATING VEHICLE LEARNER PERMIT NO LICENSE,$50.0,OP VEH LRN PMT/NOLIC
660,T780,TURNED OFF HEADLIGHTS,$25.0,TURN OFF HEADLIGHTS
661,T782,FAIL TO YIELD TO PEDESTRIAN ON SIDEWALK,$250.0,FAIL YIELD PED SDWLK
662,T786,LESS THAN 18 YRS OLD PASSENGER RESTRAINT VIOL,$50.0,LT18 PASSNGER RESTRT
663,T787,LESS THAN 18 YRS OLD MANDATORY SEAT BELT VIOL,$50.0,LT18 SEAT BLT MANDRY
664,T788,LESS THAN 18 YRS OLD NIGHT RESTRICTION,$50.0,LT18 NIGHT RESTRCTN
665,T789,LESS THAN 18 YRS OLD COMPNSTN RESTRT,$50.0,LT18 COMPNSTN RESTRT
666,T790,PROVISIONAL PERMIT PASSENGER RESTRICTION,$50.0,PROV PERM-PASS RESTR
667,T791,PROVISIONAL PERMIT NIGHT RESTRICTION,$50.0,PROV PERM NIGHT REST
668,T792,LEARNER'S  PERMIT  AGE RESTRICTION,$50.0,LEARN PERM AGE RESTR
669,T800,FAILURE TO HAVE FACE CARD WITH VEHICLE,$500.0,NO FACE CARD W/ VEH
670,T801,DCTC  POSSESS  COUNTERFEIT OR ALTERED COPY,$1000.0,COUNTERFEIT  DCTC
671,T802,PROPERTY FAIL TO DEPOSIT ITEMS W/ DCTC,$100.0,PROPERTY FAIL TO DE
672,T803,TAXI  UNLAWFUL ACTIVITES,$500.0,TAXI UNLAWFUL ACTS
673,T805,FAIL TO SHOW PROOF OF TAXICAB INSURANCE,$100.0,FAIL SHOW TAXI  INS
674,T806,RIGHT TURN ON RED FAIL  YIELD  PEDESTRIAN/VEHICLE,$50.0,RT ON RED FAIL YLD
675,T807,MOTORZED BIKE OPERATING IN EXCESS OF 20  MPH,$100.0,MTR BIKE SPEED > 20
676,T808,MOTOR DRIVEN CYCLE SPEED OPERATING >30 MPH,$100.0,MTR DRIVE CYCLE >30
677,T809,COLLIDE WITH PERSON OPERATING A  BICYCLE,$500.0,COLLIDE W BICYCLIST
678,T810,FAILURE TO YIELD RIGHT OF WAY TO A BICYCLIST,$75.0,FAIL YLD ROW  BICYCL
679,T812,BIKE NO WARNING DEVICE,$25.0,BIKE NO WARNING DEVI
680,T813,USE OF HANDHELD MOBILE TELEPHONE IN CMV,$100.0,MOBILE PHONE IN CMV
681,T814,TEXTING IN COMMERICAL MOTOR VEHICLE,$100.0,TEXTING IN CMV
682,T913,OPERATING WITHOUT SPECIAL VEHICLE FOR HIRE PERMIT,$500.0,NO SPEC VEH FOR HIRE
683,T914,FAIL TO DISPLAY INTERNATIONAL NO SMOKING SYMBOL,$25.0,FAIL DISP NO SMOKING
684,T915,CELL PHONE USE WHILE OPERATING VEHICLE,$100.0,CELL PHONE USE TAXI
